Identifier,Edition Statement,Place of Publication,Date of Publication,Publisher,Title,Author,Contributors,Corporate Author,Corporate Contributors,Former owner,Engraver,Issuance type,Flickr URL,Shelfmarks
000000216,,London; Virtue & Yorston,1868,Virtue & Co.,"All for Greed. [A novel. The dedication signed: A. A. A., i.e. Marie Pauline Rose, Baroness Blaze de Bury.]","A., A. A.","BLAZE DE BURY, Marie Pauline Rose - Baroness",,,,,monographic,http://www.flickr.com/photos/britishlibrary/tags/sysnum000000216,British Library HMNTS 12626.cc.2.
000000218,,London,1869,"Bradbury, Evans & Co.","Love the Avenger. By the author of “All for Greed.” [The dedication signed: A. A. A., i.e. Marie Pauline Rose, Baroness Blaze de Bury.]","A., A. A.","BLAZE DE BURY, Marie Pauline Rose - Baroness",,,,,monographic,http://www.flickr.com/photos/britishlibrary/tags/sysnum000000218,British Library HMNTS 12625.dd.1.
000000472,,London,1851,James Darling,"Welsh Sketches, chiefly ecclesiastical, to the close of the twelfth century. By the author of “Proposals for Christian Union” (E. S. A. [i.e. Ernest Appleyard])","A., E. S.","Appleyard, Ernest Silvanus.",,,,,monographic,http://www.flickr.com/photos/britishlibrary/tags/sysnum000000472,British Library HMNTS 10369.bbb.15.
000000480,"A new edition, revised, etc.",London,1857,Wertheim & Macintosh,"[The World in which I live, and my place in it. By E. S. A. [i.e. Letitia Willgoss Stone.] Edited by ... J. H. Broome.]","A., E. S.","BROOME, John Henry.",,,,,monographic,http://www.flickr.com/photos/britishlibrary/tags/sysnum000000480,British Library HMNTS 9007.d.28.
000000481,"Fourth edition, revised, etc.",London,1875,William Macintosh,"[The World in which I live, and my place in it. By E. S. A. [i.e. Letitia Willgoss Stone.] Edited by ... J. H. Broome.]","A., E. S.","BROOME, John Henry.",,,,,monographic,http://www.flickr.com/photos/britishlibrary/tags/sysnum000000481,British Library HMNTS 9006.ee.10.
000000519,,London,1872,The Author,Lagonells. By the author of Darmayne (F. E. A. [i.e. Florence Emily Ashley]),"A., F. E.","ASHLEY, Florence Emily.",,,,,monographic,http://www.flickr.com/photos/britishlibrary/tags/sysnum000000519,British Library HMNTS 12637.e.3.
000000667,,"pp. 40. G. Bryan & Co: Oxford, 1898",,,"The Coming of Spring, and other poems. By J. A. [i.e. J. Andrews.]","A., J.|A., J.","ANDREWS, J. - Writer of Verse",,,,,monographic,http://www.flickr.com/photos/britishlibrary/tags/sysnum000000667,British Library HMNTS 011652.g.73.
000000874,,London],1676,,"A Warning to the inhabitants of England, and London in particular ... By M. A. [i.e. Mary Adams.]",Remaʿ.,"ADAMS, Mary.",,,,,monographic,http://www.flickr.com/photos/britishlibrary/tags/sysnum000000874,British Library HMNTS 11645.bb.42.
000001143,,London,1679,,A Satyr against Vertue. (A poem: supposed to be spoken by a Town-Hector. [By John Oldham. The preface signed: T. A.]),"A., T.","OLDHAM, John.",,,,,monographic,http://www.flickr.com/photos/britishlibrary/tags/sysnum000001143,British Library HMNTS 11602.ee.10.(2.)
000001280,,Coventry,1802,Printed by J. Turner,"An Account of the many and great Loans, Benefactions and Charities, belonging to the City of Coventry ... A new edition. [The dedication signed: AB, CD, EF, GH, &c. By Edward Jackson and Samuel Carte.]",,"CARTE, Samuel.|JACKSON, Edward - Rector of Southam, and CARTE (Samuel)",,,,,monographic,http://www.flickr.com/photos/britishlibrary/tags/sysnum000001280,British Library HMNTS 1430.g.17.
000001808,,Christiania,1859,,"Erindringer som Bidrag til Norges Historie fra 1800-1815. Anden Udgave ... Udgivet med nogle Rettelser og Tillæg af Christian C. A. Lange. Med Forfatterens Portraet, og hans Biographi af Amtmand J. C. Aall","AALL, Jacob.","AALL, J. C.|LANGE, Christian Christoph Andreas.",,,,,monographic,http://www.flickr.com/photos/britishlibrary/tags/sysnum000001808,British Library HMNTS 9425.cc.37.
000001905,,Firenze,1888,,Gli Studi storici in terra d'Otranto ... Frammenti estratti in gran parte dall' Archivio Storico Italiano ... a cura e spese di L(uigi) G(iuseppe) D(e) S(imone),"AAR, Ermanno - pseud. [i.e. Luigi Giuseppe Oronzo Mariano Raffaele Francesco Fortunato Felice de Simone.]","S., L. G. D.|SIMONE, Luigi Giuseppe Oronzo Mariano Raffaele Francesco Fortunato Felice de.",,,,,monographic,http://www.flickr.com/photos/britishlibrary/tags/sysnum000001905,British Library HMNTS 10136.g.22.
000001929,,Amsterdam,"1839, 38-54",,De Aardbol. Magazijn van hedendaagsche land- en volkenkunde ... Met platen en kaarten. [Deel 4-9 by P. H. W.],,"WITKAMP, Pieter Harme.",,,,,monographic,http://www.flickr.com/photos/britishlibrary/tags/sysnum000001929,British Library HMNTS 10002.g.16-19.
000014703,,1845,1846,,First (-Third) Annual Report on the Geology of the State of Vermont,,"ADAMS, Charles Baker.",,,,,monographic,http://www.flickr.com/photos/britishlibrary/tags/sysnum000014703,British Library HMNTS 1254.h.9.
000015141,,London,1893,T. Fisher Unwin,The New Egypt. A social sketch. [Edited by J. W. Longsdon.],"ADAMS, Francis William Lauderdale.","LONGSDON, J. W.",,,,,monographic,http://www.flickr.com/photos/britishlibrary/tags/sysnum000015141,British Library HMNTS 010096.e.61.
000015146,,London,1894,T. Fisher Unwin,Tiberius: a drama ... With introduction by W. M. Rossetti,"ADAMS, Francis William Lauderdale.","ROSSETTI, William Michael.",,,,,monographic,http://www.flickr.com/photos/britishlibrary/tags/sysnum000015146,British Library HMNTS 11781.gg.4.
000016173,,enk,1817,"printed by W. Thorne, and published by J. Callow; J. Hunter; and J. Ridgway","Memoirs of the Life and Doctrines of the late John Hunter, Esq., etc","ADAMS, Joseph - M.D., F.L.S","HUNTER, John - F.R.S",,,,,monographic,http://www.flickr.com/photos/britishlibrary/tags/sysnum000016173,British Library HMNTS 982.c.27.|British Library HMNTS RB.23.b.4745.
000016543,,London,1816,John Murray,"The Narrative of Robert Adams, a sailor, who was wrecked on the Western Coast of Africa, in the year 1810 ... With a map, etc. [Edited by S. Cock.]","Adams, Robert - Sailor","COCK, Simon.",,,,,monographic,http://www.flickr.com/photos/britishlibrary/tags/sysnum000016543,British Library HMNTS 983.e.7.|British Library HMNTS 147.e.3.|British Library HMNTS G.2842.
000016544,[Another edition.],Boston,1817,Wells & Lilley,"[The Narrative of Robert Adams, a sailor, who was wrecked on the Western Coast of Africa, in the year 1810 ... With a map, etc. [Edited by S. Cock.]]","ADAMS, Robert - Sailor","COCK, Simon.",,,,,monographic,http://www.flickr.com/photos/britishlibrary/tags/sysnum000016544,British Library HMNTS 789.bb.21.
